<?xml version="1.0" encoding="UTF-8"?>
<xs:schema xmlns:xs="http://www.w3.org/2001/XMLSchema">

  <xs:element name="orders">
    <xs:complexType>
      <xs:sequence>
        <xs:element name="order" maxOccurs="unbounded">
          <xs:complexType>
            <xs:sequence>
              <xs:element name="customer" type="xs:string"/>
              <xs:element name="dish_id">
                <xs:simpleType>
                  <xs:restriction base="xs:integer">
                    <xs:minInclusive value="1"/>
                    <xs:maxInclusive value="6"/>
                  </xs:restriction>
                </xs:simpleType>
              </xs:element>
              <xs:element name="quantity">
                <xs:simpleType>
                  <xs:restriction base="xs:integer">
                    <xs:minExclusive value="0"/>
                  </xs:restriction>
                </xs:simpleType>
              </xs:element>
              <xs:element name="price">
                <xs:simpleType>
                  <xs:restriction base="xs:string">
                    <xs:pattern value="^\$\d+(\.\d+)?$"/>
                  </xs:restriction>
                </xs:simpleType>
              </xs:element>
              <xs:element name="time" type="xs:dateTime"/>
            </xs:sequence>
          </xs:complexType>
        </xs:element>
      </xs:sequence>
    </xs:complexType>
  </xs:element>

</xs:schema>
