<?xml version="1.0" encoding="UTF-8"?>
<orders xmlns:xsi="http://www.w3.org/2001/XMLSchema-instance" xsi:noNamespaceSchemaLocation="orders.xsd">
  <order>
    <customer>Olivia</customer>
    <dish_id>1</dish_id>
    <quantity>2</quantity>
    <price>$4.5</price>
    <time>2025-07-01T10:15:00</time>
  </order>
  <order>
    <customer>Marcus</customer>
    <dish_id>3</dish_id>
    <quantity>1</quantity>
    <price>$10</price>
    <time>2025-07-02T13:45:00</time>
  </order>
  <order>
    <customer>Priya</customer>
    <dish_id>2</dish_id>
    <quantity>3</quantity>
    <price>$21</price>
    <time>2025-07-02T18:30:00</time>
  </order>
  <order>
    <customer>Ethan</customer>
    <dish_id>4</dish_id>
    <quantity>1</quantity>
    <price>$10</price>
    <time>2025-07-03T12:00:00</time>
  </order>
  <order>
    <customer>Zoe</customer>
    <dish_id>1</dish_id>
    <quantity>1</quantity>
    <price>$4.5</price>
    <time>2025-07-04T09:05:00</time>
  </order>
  <order>
    <customer>Carlos</customer>
    <dish_id>5</dish_id>
    <quantity>2</quantity>
    <price>$2.5</price>
    <time>2025-07-04T16:50:00</time>
  </order>
  <order>
    <customer>Lina</customer>
    <dish_id>2</dish_id>
    <quantity>2</quantity>
    <price>$21</price>
    <time>2025-07-05T11:20:00</time>
  </order>
</orders>
